{
  "schemaVersion": "cautilus.runner_assessment.v1",
  "runnerId": "default-eval-runner",
  "surface": "app/chat",
  "proofClass": "in-process-product-runner",
  "assessedBy": "maintainer-review",
  "assessedAt": "2026-04-30T00:00:00Z",
  "repoCommit": "0123456789abcdef0123456789abcdef01234567",
  "adapterPath": ".agents/cautilus-adapter.yaml",
  "adapterHash": "sha256:aaaaaaaaaaaaaaaaaaaaaaaaaaaaaaaaaaaaaaaaaaaaaaaaaaaaaaaaaaaaaaaa",
  "runnerFiles": [
    {
      "path": "scripts/eval/run-product-chat.mjs",
      "sha256": "sha256:bbbbbbbbbbbbbbbbbbbbbbbbbbbbbbbbbbbbbbbbbbbbbbbbbbbbbbbbbbbbbbbb"
    }
  ],
  "claims": [
    {
      "claimId": "claim-readme-md-3",
      "summary": "The product chat remembers prior user preferences."
    }
  ],
  "assessedRequirement": {
    "proofMechanism": "cautilus-eval",
    "recommendedEvalSurface": "app/chat",
    "requiredRunnerCapability": "headless-product-chat-runner",
    "requiredObservability": ["transcript", "finalText", "runtimeFingerprint"]
  },
  "productionPathReuse": {
    "modules": ["src/app/chat/route.ts", "src/ai/prompt-builder.ts"],
    "notes": "The runner imports the product route handler and prompt builder instead of copying the prompt."
  },
  "observability": {
    "emits": ["normalizedMessages", "transcript", "finalText", "runtimeFingerprint", "diagnostics"]
  },
  "knownGaps": [],
  "recommendation": "ready-for-selected-surface"
}
